id,original_id,title,created_time,modified_time,desc,creator,keywords,categories,type,ext,size,version,doc_id,parent_id,thumbnail,derived,store_key,content
201902_3736920,201902_3736920,阿斯特克有限公司申请设立海事赔偿责任限制基金案,2019/2/25 0:00,2019/2/25 11:24,海商法第二百一十二条确立海事赔偿责任限制实行 “一次事故，一个限额，多次事故，多个限额”的原则。,最高人民法院,[民事],"{""id"": 1,""title"": ""民事"",""desc"": null}",doc,doc,1024,0,null,null,null,null,null,裁判要点　　海商法第二百一十二条确立海事赔偿责任限制实行 “一次事故，一个限额，多次事故，多个限额”的原则。判断一次事故还是多次事故的关键是分析事故之间是否因同一原因所致。如果因同一原因发生多个事故，且原因链没有中断的，应认定为一次事故。如果原因链中断并再次发生事故，则应认定为形成新的独立事故。　　相关法条　　《中华人民共和国海商法》第212条　　基本案情　　阿斯特克有限公司向天津海事法院提出申请称，其所属的“艾侬”轮收到养殖损害索赔请求。对于该次事故所造成的非人身伤亡损失，阿斯特克有限公司作为该轮的船舶所有人申请设立海事赔偿责任限制基金，责任限额为422510特别提款权及该款项自2014年6月5日起至基金设立之日止的利息。　　众多养殖户作为利害关系人提出异议，认为阿斯特克有限公司应当分别设立限制基金，而不能就整个航次设立一个限制基金。　　法院查明：涉案船舶韩国籍“艾侬”轮的所有人为阿斯特克有限公司，船舶总吨位为2030吨。2014年6月5日，“艾侬”轮自秦皇岛开往天津港装货途中，在河北省昌黎县、乐亭县海域驶入养殖区域，造成了相关养殖户的养殖损失。　　另查明，“艾侬”轮在本案损害事故发生时使用英版1249号海图，该海图已标明本案损害事故发生的海域设置了养殖区，并划定了养殖区范围。涉案船舶为执行涉案航次所预先设定的航线穿越该养殖区。　　再查明，郭金武与刘海忠的养殖区相距约500米左右，涉案船舶航行时间约2分钟；刘海忠与李卫国等人的养殖区相距约9000米左右，涉案船舶航行时间约30分钟。　　裁判结果　　天津海事法院于2014年11月10日作出（2014）津海法限字第1号民事裁定：一、准许阿斯特克有限公司提出的设立海事赔偿责任限制基金的申请。二、海事赔偿责任限制基金数额为422510特别提款权及利息（利息自2014年6月5日起至基金设立之日止，按中国人民银行确定的金融机构同期一年期贷款基准利率计算）。三、阿斯特克有限公司应在裁定生效之日起三日内以人民币或法院认可的担保设立海事赔偿责任限制基金（基金的人民币数额按本裁定生效之日的特别提款权对人民币的换算办法计算）。逾期不设立基金的，按自动撤回申请处理。郭金武、刘海忠不服一审裁定，向天津市高级人民法院提起上诉。天津市高级人民法院于2015年1月19日作出（2015）津高民四终字第10号民事裁定：驳回上诉，维持原裁定。郭金武、刘海忠、李卫国、赵来军、齐永平、李建永、齐秀奎不服二审裁定，申请再审。最高人民法院于2015年8月10日作出（2015）民申字第853号民事裁定，提审本案，并于2015年9月29日作出（2015）民提字第151号民事裁定：一、撤销天津市高级人民法院（2015）津高民四终字第10号民事裁定。二、撤销天津海事法院（2014）津海法限字第1号民事裁定。三、驳回阿斯特克有限公司提出的设立海事赔偿责任限制基金的申请。　　裁判理由　　最高人民法院认为，海商法第二百一十二条确立海事赔偿责任限制实行事故原则，即“一次事故，一个限额，多次事故，多个限额”。判断一次还是多次事故的关键是分析两次事故之间是否因同一原因所致。如果因同一原因发生多个事故，但原因链没有中断，则应认定为一个事故。如果原因链中断，有新的原因介入，则新的原因与新的事故构成新的因果关系，形成新的独立事故。就本案而言，涉案“艾侬”轮所使用的英版海图明确标注了养殖区范围，但船员却将航线设定到养殖区，本身存在重大过错。涉案船舶在预知所经临的海域可能存在大面积养殖区的情形下，应加强t望义务，保证航行安全，避免冲撞养殖区造成损失。根据涉案船舶航行轨迹，涉案船舶实际驶入了郭金武经营的养殖区。鉴于损害事故发生于中午时分，并无夜间的视觉障碍，如船员谨慎履行t望和驾驶义务，应能注意到海面上悬挂养殖物浮球的存在。在昌黎县海洋局出具证据证明郭金武遭受实际损害的情形下，可以推定船员未履行谨慎t望义务，导致第一次侵权行为发生。依据航行轨迹，船舶随后进入刘海忠的养殖区，由于郭金武与刘海忠的养殖区毗邻，相距约500米，基于船舶运动的惯性及船舶驾驶规律，涉案船舶在当时情形下无法采取合理措施避让刘海忠的养殖区，致使第二次侵权行为发生。从原因上分析，两次损害行为均因船舶驶入郭金武养殖区之前，船员疏于t望的过失所致，属同一原因，且原因链并未中断，故应将两次侵权行为认定为一次事故。船舶驶离刘海忠的养殖区进入开阔海域，航行约9000米，时长约半小时后进入李卫国等人的养殖区再次造成损害事故。在进入李卫国等人的养殖区之前，船员应有较为充裕的时间调整驾驶疏忽的心理状态，且在预知航行前方还有养殖区存在的情形下，更应加强t望义务，避免再次造成损害。涉案船舶显然未尽到谨慎驾驶的义务，致使第二次损害事故的发生。两次事故之间无论从时间关系还是从主观状态均无关联性，第二次事故的发生并非第一次事故自然延续所致，两次事故之间并无因果关系。阿斯特克有限公司主张在整个事故发生过程中船员错误驶入的心理状态没有变化，原因链没有中断的理由不能成立。虽然两次事故的发生均因“同一性质的原因”，即船员疏忽驾驶所致，但并非基于“同一原因”，引起两次事故。依据“一次事故，一次限额”的原则，涉案船舶应分别针对两次事故设立不同的责任限制基金。一、二审法院未能全面考察养殖区的位置、两次事故之间的因果关系及当事人的主观状态，作出涉案船舶仅造成一次事故，允许涉案船舶设立一个基金的认定错误，依法应予纠正。　　（生效裁判审判人员：王淑梅、傅晓强、黄西武）
201902_3736917,201902_3736917,中国建设银行股份有限公司广州荔湾支行诉广东蓝粤能源发展有限公司等信用证开证纠纷案,2019/2/25 0:00,2019/2/25 11:22,提单持有人是否因受领提单的交付而取得物权以及取得何种类型的物权，取决于合同的约定。,最高人民法院,[民事],"{""id"": 1,""title"": ""民事"",""desc"": null}",doc,doc,1024,0,null,null,null,null,null,　　裁判要点　　1.提单持有人是否因受领提单的交付而取得物权以及取得何种类型的物权，取决于合同的约定。开证行根据其与开证申请人之间的合同约定持有提单时，人民法院应结合信用证交易的特点，对案涉合同进行合理解释，确定开证行持有提单的真实意思表示。　　2.开证行对信用证项下单据中的提单以及提单项下的货物享有质权的，开证行行使提单质权的方式与行使提单项下货物动产质权的方式相同，即对提单项下货物折价、变卖、拍卖后所得价款享有优先受偿权。　　相关法条　　《中华人民共和国海商法》第71条　　《中华人民共和国物权法》第224条　　《中华人民共和国合同法》第80条第1款　　基本案情　　中国建设银行股份有限公司广州荔湾支行（以下简称建行广州荔湾支行）与广东蓝粤能源发展有限公司（以下简称蓝粤能源公司）于2011年12月签订了《贸易融资额度合同》及《关于开立信用证的特别约定》等相关附件，约定该行向蓝粤能源公司提供不超过5.5亿元的贸易融资额度，包括开立等值额度的远期信用证。惠来粤东电力燃料有限公司（以下简称粤东电力）等担保人签订了保证合同等。2012年11月，蓝粤能源公司向建行广州荔湾支行申请开立8592万元的远期信用证。为开立信用证，蓝粤能源公司向建行广州荔湾支行出具了《信托收据》，并签订了《保证金质押合同》。《信托收据》确认自收据出具之日起，建行广州荔湾支行即取得上述信用证项下所涉单据和货物的所有权，建行广州荔湾支行为委托人和受益人，蓝粤能源公司为信托货物的受托人。信用证开立后，蓝粤能源公司进口了164998吨煤炭。建行广州荔湾支行承兑了信用证，并向蓝粤能源公司放款84867952.27元，用于蓝粤能源公司偿还建行首尔分行的信用证垫款。建行广州荔湾支行履行开证和付款义务后，取得了包括本案所涉提单在内的全套单据。蓝粤能源公司因经营状况恶化而未能付款赎单，故建行广州荔湾支行在本案审理过程中仍持有提单及相关单据。提单项下的煤炭因其他纠纷被广西防城港市港口区人民法院查封。建行广州荔湾支行提起诉讼，请求判令蓝粤能源公司向建行广州荔湾支行清偿信用证垫款本金84867952.27元及利息；确认建行广州荔湾支行对信用证项下164998吨煤炭享有所有权，并对处置该财产所得款项优先清偿上述信用证项下债务；粤东电力等担保人承担担保责任。　　裁判结果　　广东省广州市中级人民法院于2014年4月21日作出（2013）穗中法金民初字第158号民事判决，支持建行广州荔湾支行关于蓝粤能源公司还本付息以及担保人承担相应担保责任的诉请，但以信托收据及提单交付不能对抗第三人为由，驳回建行广州荔湾支行关于请求确认煤炭所有权以及优先受偿权的诉请。建行广州荔湾支行不服一审判决，提起上诉。广东省高级人民法院于2014年9月19日作出（2014）粤高法民二终字第45号民事判决，驳回上诉，维持原判。建行广州荔湾支行不服二审判决，向最高人民法院申请再审。最高人民法院于2015年10月19日作出（2015）民提字第126号民事判决，支持建行广州荔湾支行对案涉信用证项下提单对应货物处置所得价款享有优先受偿权，驳回其对案涉提单项下货物享有所有权的诉讼请求。　　裁判理由　　最高人民法院认为，提单具有债权凭证和所有权凭证的双重属性，但并不意味着谁持有提单谁就当然对提单项下货物享有所有权。对于提单持有人而言，其能否取得物权以及取得何种类型的物权，取决于当事人之间的合同约定。建行广州荔湾支行履行了开证及付款义务并取得信用证项下的提单，但是由于当事人之间没有移转货物所有权的意思表示，故不能认为建行广州荔湾支行取得提单即取得提单项下货物的所有权。虽然《信托收据》约定建行广州荔湾支行取得货物的所有权，并委托蓝粤能源公司处置提单项下的货物，但根据物权法定原则，该约定因构成让与担保而不能发生物权效力。然而，让与担保的约定虽不能发生物权效力，但该约定仍具有合同效力，且《关于开立信用证的特别约定》约定蓝粤能源公司违约时，建行广州荔湾支行有权处分信用证项下单据及货物，因此根据合同整体解释以及信用证交易的特点，表明当事人真实意思表示是通过提单的流转而设立提单质押。本案符合权利质押设立所须具备的书面质押合同和物权公示两项要件，建行广州荔湾支行作为提单持有人，享有提单权利质权。建行广州荔湾支行的提单权利质权如果与其他债权人对提单项下货物所可能享有的留置权、动产质权等权利产生冲突的，可在执行分配程序中依法予以解决。　　（生效裁判审判人员：刘贵祥、刘敏、高晓力）
201902_3736913,201902_3736913,交通运输部南海救助局诉阿昌格罗斯投资公司、香港安达欧森有限公司上海代表处海难救助合同纠纷案,2019/2/25 0:00,2019/2/25 11:21,《1989年国际救助公约》和我国海商法规定救助合同“无效果无报酬”，但均允许当事人对救助报酬的确定可以另行约定。,最高人民法院,[民事],"{""id"": 1,""title"": ""民事"",""desc"": null}",doc,doc,1024,0,null,null,null,null,null,裁判要点　　1. 《1989年国际救助公约》和我国海商法规定救助合同“无效果无报酬”，但均允许当事人对救助报酬的确定可以另行约定。若当事人明确约定，无论救助是否成功，被救助方均应支付报酬，且以救助船舶每马力小时和人工投入等作为计算报酬的标准时，则该合同系雇佣救助合同，而非上述国际公约和我国海商法规定的救助合同。　　2. 在《1989年国际救助公约》和我国海商法对雇佣救助合同没有具体规定的情况下，可以适用我国合同法的相关规定确定当事人的权利义务。　　相关法条　　《中华人民共和国合同法》第8条、第107条　　《中华人民共和国海商法》第179条　　基本案情　　交通运输部南海救助局（以下简称南海救助局）诉称：“加百利”轮在琼州海峡搁浅后，南海救助局受阿昌格罗斯投资公司(以下简称投资公司)委托提供救助、交通、守护等服务，但投资公司一直未付救助费用。请求法院判令投资公司和香港安达欧森有限公司上海代表处（以下简称上海代表处）连带支付救助费用7240998.24元及利息。　　法院经审理查明：投资公司所属“加百利”轮系希腊籍油轮，载有卡宾达原油54580吨。2011年8月12日0500时左右在琼州海峡北水道附近搁浅，船舶及船载货物处于危险状态，严重威胁海域环境安全。事故发生后，投资公司立即授权上海代表处就“加百利”轮搁浅事宜向南海救助局发出紧急邮件，请南海救助局根据经验安排两艘拖轮进行救助，并表示同意南海救助局的报价。　　8月12日2040时，上海代表处通过电子邮件向南海救助局提交委托书，委托南海救助局派出“南海救116”轮和“南海救101”轮到现场协助“加百利”轮出浅，承诺无论能否成功协助出浅，均同意按每马力小时3.2元的费率付费，计费周期为拖轮自其各自的值班待命点备车开始起算至上海代表处通知任务结束、拖轮回到原值班待命点为止。“南海救116”轮和“南海救101”轮只负责拖带作业，“加百利”轮脱浅作业过程中如发生任何意外南海救助局无需负责。另，请南海救助局派遣一组潜水队员前往“加百利”轮探摸，费用为：陆地调遣费10000元；水上交通费55000元；作业费每8小时40000元，计费周期为潜水员登上交通船开始起算，到作业完毕离开交通船上岸为止。8月13日，投资公司还提出租用“南海救201”轮将其两名代表从海口运送至“加百利”轮。南海救助局向上海代表处发邮件称，“南海救201”轮费率为每马力小时1.5元，根据租用时间计算总费用。　　与此同时，为预防危险局面进一步恶化造成海上污染，湛江海事局决定对“加百利”轮采取强制过驳减载脱浅措施。经湛江海事局组织安排，8月18日“加百利”轮利用高潮乘潮成功脱浅，之后安全到达目的港广西钦州港。　　南海救助局实际参与的救助情况如下：　　南海救助局所属“南海救116”轮总吨为3681，总功率为9000千瓦（12240马力）。“南海救116”轮到达事故现场后，根据投资公司的指示，一直在事故现场对“加百利”轮进行守护，共工作155.58小时。　　南海救助局所属“南海救101”轮总吨为4091，总功率为13860千瓦（18850马力）。该轮未到达事故现场即返航。南海救助局主张该轮工作时间共计13.58小时。　　南海救助局所属“南海救201”轮总吨为552，总功率为4480千瓦（6093马力）。8月13日，该轮运送2名船东代表登上搁浅船，工作时间为7.83小时。8月16日，该轮运送相关人员及设备至搁浅船，工作时间为7.75小时。8月18日，该轮将相关人员及行李运送上过驳船，工作时间为8.83小时。　　潜水队员未实际下水作业，工作时间为8小时。　　另查明涉案船舶的获救价值为30531856美元，货物的获救价值为48053870美元，船舶的获救价值占全部获救价值的比例为38.85%。　　裁判结果　　广州海事法院于2014年3月28日作出(2012)广海法初字第898号民事判决:一、投资公司向南海救助局支付救助报酬6592913.58元及利息；二、驳回南海救助局的其他诉讼请求。投资公司不服一审判决，提起上诉。广东省高级人民法院于2015年6月16日作出（2014）粤高法民四终字第117号民事判决:一、撤销广州海事法院（2012）广海法初字第898号民事判决;二、投资公司向南海救助局支付救助报酬2561346.93元及利息；三、驳回南海救助局的其他诉讼请求。南海救助局不服二审判决，申请再审。最高人民法院于2016年7月7日作出（2016）最高法民再61号民事判决: 一、撤销广东省高级人民法院（2014）粤高法民四终字第117号民事判决；二、维持广州海事法院（2012）广海法初字第898号民事判决。　　裁判理由　　最高人民法院认为，本案系海难救助合同纠纷。中华人民共和国加入了《1989年国际救助公约》（以下简称救助公约），救助公约所确立的宗旨在本案中应予遵循。因投资公司是希腊公司，“加百利”轮为希腊籍油轮，本案具有涉外因素。各方当事人在诉讼中一致选择适用中华人民共和国法律，根据《中华人民共和国涉外民事关系法律适用法》第三条的规定，适用中华人民共和国法律对本案进行审理。我国海商法作为调整海上运输关系、船舶关系的特别法，应优先适用。海商法没有规定的，适用我国合同法等相关法律的规定。　　海难救助是一项传统的国际海事法律制度，救助公约和我国海商法对此作了专门规定。救助公约第十二条、海商法第一百七十九条规定了“无效果无报酬”的救助报酬支付原则，救助公约第十三条、海商法第一百八十条及第一百八十三条在该原则基础上进一步规定了报酬的评定标准与具体承担。上述条款是对当事人基于“无效果无报酬”原则确定救助报酬的海难救助合同的具体规定。与此同时，救助公约和我国海商法均允许当事人对救助报酬的确定另行约定。因此，在救助公约和我国海商法规定的“无效果无报酬”救助合同之外，还可以依当事人的约定形成雇佣救助合同。　　根据本案查明的事实，投资公司与南海救助局经过充分磋商，明确约定无论救助是否成功，投资公司均应支付报酬，且“加百利”轮脱浅作业过程中如发生任何意外，南海救助局无需负责。依据该约定，南海救助局救助报酬的获得与否和救助是否有实际效果并无直接联系，而救助报酬的计算，是以救助船舶每马力小时，以及人工投入等事先约定的固定费率和费用作为依据，与获救财产的价值并无关联。因此，本案所涉救助合同不属于救助公约和我国海商法所规定的“无效果无报酬”救助合同，而属雇佣救助合同。　　关于雇佣救助合同下的报酬支付条件及标准，救助公约和我国海商法并未作具体规定。一、二审法院依据海商法第一百八十条规定的相关因素对当事人在雇佣救助合同中约定的固定费率予以调整，属适用法律错误。本案应依据我国合同法的相关规定，对当事人的权利义务予以规范和确定。南海救助局以其与投资公司订立的合同为依据，要求投资公司全额支付约定的救助报酬并无不当。　　综上，二审法院以一审判决确定的救助报酬数额为基数，依照海商法的规定，判令投资公司按照船舶获救价值占全部获救财产价值的比例支付救助报酬，适用法律和处理结果错误，应予纠正。一审判决适用法律错误，但鉴于一审判决对相关费率的调整是以当事人的合同约定为基础，南海救助局对此并未行使相关诉讼权利提出异议，一审判决结果可予维持。　　（生效裁判审判人员：贺荣、张勇健、王淑梅、余晓汉、郭载宇）
